{
  "$schema": "../schemas/active-task.schema.json",
  "taskId": "2026-08-27-phase1-demo",
  "stage": "verification",
  "lastUpdated": "2026-09-14T06:00:03.5953048Z",
  "currentGoal": "Deploy the verified ORA exact-date routing guard and repeat the Railway demo flow.",
  "nextAction": "Review, commit/push and deploy the two-file fix, then repeat START DEMO, name and exact date/time through Railway.",
  "blocked": false
}
